<?xml version="1.0" encoding="UTF-8"?>
<list xmlns:xsi="http://www.w3.org/2001/XMLSchema-instance" xmlns="http://l2j.org" xsi:schemaLocation="http://l2j.org items.xsd">
	<armor id="20020" name="Uniform Hat - Not Available" type="NONE" body-part="GLOVES">
	<!-- The item is not available. A very fancy hat.\n\n<font color=eeaa22>Occupies the left hair accessory slot.</font> -->
		<restriction sellable="false"/>
		<attributes weight="10" />
		<crystal />
	</armor>

	<armor id="20021" name="Assassin's Bamboo Hat - Not Available" type="NONE" body-part="GLOVES">
	<!-- The item is not available. A hat made from bulrush.\n\n<font color=eeaa22>Occupies the left hair accessory slot.</font> -->
		<restriction sellable="false"/>
		<attributes weight="10" />
		<crystal />
	</armor>

	<armor id="20022" name="Ruthless Tribe Mask - Not Available" type="NONE" body-part="HAIR">
	<!-- The item is not available. Mask worn by a ruthless tribe.\n\n<font color=eeaa22>Occupies the left hair accessory slot.</font> -->
		<restriction sellable="false"/>
		<attributes weight="10" />
		<crystal />
	</armor>

	<armor id="20023" name="Ribbon Hairband - Not Available" type="NONE" body-part="HAIR">
	<!-- The item is not available. A ribbon-like hair accessory, intended for female characters only.\n\n<font color=eeaa22>Occupies the left hair accessory slot.</font> -->
		<restriction sellable="false"/>
		<attributes weight="10" />
		<crystal />
	</armor>

	<item id="20033" name="My Teleport Flag" type="NONE">
	<!-- The item is used when the current location of an Unoccupied Teleport Device is saved. -->
		<restriction/>
		<attributes weight="5"/>
	</item>

</list>