<?xml version="1.0" encoding="UTF-8"?>
<list xmlns:xsi="http://www.w3.org/2001/XMLSchema-instance" xmlns="http://l2j.org" xsi:schemaLocation="http://l2j.org items.xsd">
	<item id="35741" name="Scroll: PK (Low-grade)" type="SCROLL">
	<!-- Double-click to lower PK value by 1. It can only be used when the PK value is greater than 1 and reputation is 0. -->
		<restriction stackable="true" olympiad-restricted="true" sellable="false"/>
		<attributes weight="10" commission-type="SCROLL_OTHER" action="SKILL_REDUCE"/>
		<skill-reducer type="ItemSkills">
			<skill id="9504" value="-1"/>  <!-- Scroll: PK (Low-grade) -->
		</skill-reducer>
	</item>

	<item id="35752" name="Scroll: PK (Mid-grade)" type="SCROLL">
	<!-- Double-click to lower PK value by 3. Must be in Floran Village to use. It can only be used when the PK value is greater than or equal to 1. -->
		<restriction stackable="true" olympiad-restricted="true" sellable="false"/>
		<attributes weight="10" commission-type="SCROLL_OTHER" action="SKILL_REDUCE_ON_SKILL_SUCCESS"/>
		<skill-reducer type="ItemSkills">
			<skill id="9505" value="-1"/>  <!-- Scroll: PK (Mid-grade) -->
		</skill-reducer>
	</item>

	<item id="35753" name="Scroll: PK (High-grade)" type="SCROLL">
	<!-- Double-click to lower PK value by 5. Must be in Floran Village to use. It can only be used when the PK value is greater than or equal to 1. -->
		<restriction stackable="true" olympiad-restricted="true" sellable="false"/>
		<attributes weight="10" commission-type="SCROLL_OTHER" action="SKILL_REDUCE_ON_SKILL_SUCCESS"/>
		<skill-reducer type="ItemSkills">
			<skill id="9506" value="-1"/>  <!-- Scroll: PK (High-grade) -->
		</skill-reducer>
	</item>

	<item id="35754" name="Scroll: PK (Top-grade)" type="SCROLL">
	<!-- Double-click to lower PK value by 10. Must be in Floran Village to use. It can only be used when the PK value is greater than or equal to 1. -->
		<restriction stackable="true" olympiad-restricted="true" sellable="false"/>
		<attributes weight="10" commission-type="SCROLL_OTHER" action="SKILL_REDUCE_ON_SKILL_SUCCESS"/>
		<skill-reducer type="ItemSkills">
			<skill id="9507" value="-1"/>  <!-- Scroll: PK (Top-grade) -->
		</skill-reducer>
	</item>

</list>