<?xml version="1.0" encoding="UTF-8"?>
<list xmlns:xsi="http://www.w3.org/2001/XMLSchema-instance" xmlns="http://l2j.org" xsi:schemaLocation="http://l2j.org items.xsd">
	<armor id="17270" name="Agathion Nevit's Messenger Kanna - Not Available" type="NONE" body-part="FEET">
	<!-- The item is not available. Double-click to summon Agathion Nevit's Messenger Kanna. Cannot be exchanged, dropped, sold in the private store, or transferred within the account through Game Assistants. Can be stored in the private warehouse. -->
		<restriction freightable="false" tradable="false" dropable="false" sellable="false" private-sellable="false"/>
		<attributes weight="150" enchant-enabled="false" />
		<crystal />
		<stats>
			<stat type="MAGICAL_DEFENCE" value="40.0"/>
		</stats>
		<skills>
			<skill id="8522" value="-1"/>  <!-- Summon Agathion Nevit's Messenger Kanna -->
		</skills>
	</armor>

</list>