<?xml version="1.0" encoding="UTF-8"?>
<list xmlns:xsi="http://www.w3.org/2001/XMLSchema-instance" xmlns="http://l2j.org" xsi:schemaLocation="http://l2j.org items.xsd">
	<weapon id="38211" name="Blue Mackerel: One-handed Sword" type="SWORD" body-part="RIGHT_HAND">
		<restriction freightable="false" dropable="false" sellable="false"/>
		<attributes weight="1450" commission-type="OTHER_ITEM" enchant-enabled="false"/>
		<crystal />
		<damage radius="40" angle="240"/>
		<stats>
			<stat type="CRITICAL_RATE" value="8.0"/>
			<stat type="MAGIC_ATTACK" value="47.0"/>
			<stat type="PHYSICAL_ATTACK" value="79.0"/>
			<stat type="PHYSICAL_ATTACK_RANGE" value="40.0"/>
			<stat type="PHYSICAL_ATTACK_SPEED" value="379.0"/>
			<stat type="RANDOM_DAMAGE" value="10.0"/>
		</stats>
	</weapon>

	<weapon id="38212" name="Trumpetfish: Dagger" type="DAGGER" body-part="RIGHT_HAND">
		<restriction freightable="false" dropable="false" sellable="false"/>
		<attributes weight="1070" commission-type="OTHER_ITEM" enchant-enabled="false"/>
		<crystal />
		<damage radius="40" angle="240"/>
		<stats>
			<stat type="ACCURACY" value="-3.75"/>
			<stat type="CRITICAL_RATE" value="12.0"/>
			<stat type="MAGIC_ATTACK" value="42.0"/>
			<stat type="PHYSICAL_ATTACK" value="62.0"/>
			<stat type="PHYSICAL_ATTACK_RANGE" value="40.0"/>
			<stat type="PHYSICAL_ATTACK_SPEED" value="433.0"/>
			<stat type="RANDOM_DAMAGE" value="5.0"/>
		</stats>
	</weapon>

	<weapon id="38213" name="Shark: Two-handed Sword" type="TWO_HAND_SWORD" body-part="TWO_HAND">
		<restriction freightable="false" dropable="false" sellable="false"/>
		<attributes weight="2020" commission-type="OTHER_ITEM" enchant-enabled="false"/>
		<crystal />
		<damage radius="40" angle="240"/>
		<stats>
			<stat type="CRITICAL_RATE" value="8.0"/>
			<stat type="MAGIC_ATTACK" value="47.0"/>
			<stat type="PHYSICAL_ATTACK" value="96.0"/>
			<stat type="PHYSICAL_ATTACK_RANGE" value="40.0"/>
			<stat type="PHYSICAL_ATTACK_SPEED" value="325.0"/>
			<stat type="RANDOM_DAMAGE" value="10.0"/>
		</stats>
	</weapon>

	<weapon id="38214" name="Squid: Spear" type="SPEAR" body-part="TWO_HAND">
		<restriction freightable="false" dropable="false" sellable="false"/>
		<attributes weight="2060" commission-type="OTHER_ITEM" enchant-enabled="false"/>
		<crystal />
		<damage radius="66" angle="240"/>
		<stats>
			<stat type="ACCURACY" value="-3.75"/>
			<stat type="CRITICAL_RATE" value="8.0"/>
			<stat type="MAGIC_ATTACK" value="47.0"/>
			<stat type="PHYSICAL_ATTACK" value="79.0"/>
			<stat type="PHYSICAL_ATTACK_RANGE" value="80.0"/>
			<stat type="PHYSICAL_ATTACK_SPEED" value="325.0"/>
			<stat type="RANDOM_DAMAGE" value="10.0"/>
		</stats>
		<skills>
			<skill id="3599" value="-1"/>  <!-- Polearm Multi-attack -->
		</skills>
	</weapon>

	<weapon id="38215" name="Sea Horse: Two-handed Magic Blunt Weapon" type="STAFF" body-part="TWO_HAND" magic="true">
		<restriction freightable="false" dropable="false" sellable="false"/>
		<attributes weight="1000" commission-type="OTHER_ITEM" enchant-enabled="false"/>
		<crystal />
		<damage radius="40" angle="240"/>
		<stats>
			<stat type="ACCURACY" value="8.0"/>
			<stat type="CRITICAL_RATE" value="6.0"/>
			<stat type="MAGIC_ATTACK" value="69.0"/>
			<stat type="PHYSICAL_ATTACK" value="77.0"/>
			<stat type="PHYSICAL_ATTACK_RANGE" value="40.0"/>
			<stat type="PHYSICAL_ATTACK_SPEED" value="325.0"/>
			<stat type="RANDOM_DAMAGE" value="19.0"/>
		</stats>
	</weapon>

	<weapon id="38216" name="Lobster: Fist Weapon" type="FIST" body-part="TWO_HAND">
		<restriction freightable="false" dropable="false" sellable="false"/>
		<attributes weight="1510" commission-type="OTHER_ITEM" enchant-enabled="false"/>
		<crystal />
		<damage radius="40" angle="240"/>
		<stats>
			<stat type="ACCURACY" value="8.0"/>
			<stat type="CRITICAL_RATE" value="6.0"/>
			<stat type="MAGIC_ATTACK" value="47.0"/>
			<stat type="PHYSICAL_ATTACK" value="96.0"/>
			<stat type="PHYSICAL_ATTACK_RANGE" value="40.0"/>
			<stat type="PHYSICAL_ATTACK_SPEED" value="325.0"/>
			<stat type="RANDOM_DAMAGE" value="5.0"/>
		</stats>
	</weapon>

	<weapon id="38217" name="Giant Crab: Bow" type="BOW" body-part="TWO_HAND" mana-consume="2">
		<restriction freightable="false" dropable="false" sellable="false"/>
		<attributes weight="1820" commission-type="OTHER_ITEM" reuse-delay="1500" enchant-enabled="false"/>
		<crystal />
		<damage radius="40" angle="240"/>
		<stats>
			<stat type="ACCURACY" value="-3.75"/>
			<stat type="CRITICAL_RATE" value="12.0"/>
			<stat type="MAGIC_ATTACK" value="51.0"/>
			<stat type="PHYSICAL_ATTACK" value="179.0"/>
			<stat type="PHYSICAL_ATTACK_RANGE" value="500.0"/>
			<stat type="PHYSICAL_ATTACK_SPEED" value="293.0"/>
			<stat type="RANDOM_DAMAGE" value="5.0"/>
		</stats>
	</weapon>

	<armor id="38220" name="Turtle: Shield" type="SHIELD" body-part="LEFT_HAND">
		<restriction freightable="false" dropable="false" sellable="false"/>
		<attributes weight="1320" enchant-enabled="false" />
		<crystal />
		<stats>
			<stat type="SHIELD_DEFENCE" value="142.0"/>
			<stat type="SHIELD_DEFENCE_RATE" value="20.0"/>
		</stats>
	</armor>

	<weapon id="38221" name="Blue Mackerel: Dual Sword" type="DUAL" body-part="TWO_HAND">
		<restriction freightable="false" dropable="false" sellable="false"/>
		<attributes weight="2530" commission-type="OTHER_ITEM"/>
		<crystal />
		<damage radius="40" angle="240"/>
		<stats>
			<stat type="CRITICAL_RATE" value="8.0"/>
			<stat type="MAGIC_ATTACK" value="47.0"/>
			<stat type="PHYSICAL_ATTACK" value="96.0"/>
			<stat type="PHYSICAL_ATTACK_RANGE" value="40.0"/>
			<stat type="PHYSICAL_ATTACK_SPEED" value="325.0"/>
			<stat type="RANDOM_DAMAGE" value="10.0"/>
		</stats>
	</weapon>

</list>