<?xml version="1.0" encoding="UTF-8"?>
<list xmlns:xsi="http://www.w3.org/2001/XMLSchema-instance" xmlns="http://l2j.org" xsi:schemaLocation="http://l2j.org items.xsd">
	<item id="72100" name="Devoted Hero's Doll - Baium" type="NONE">
	<!-- <Baium Doll's Sorcery Lv. 3>\nSkill Cooldown -4%\nP. Def. +15%\nM. Def. +15%\nSilence Resistance +45%\nFear Resistance +45%\nParalysis Resistance +25%\nKnockback Resistance +25%\nPull Resistance +25%\n\nBoosts parameters when in inventory. -->
		<restriction stackable="true" tradable="false" dropable="false" sellable="false" private-sellable="false" clan-depositable="false" castle-depositable="false" freightable="false"/>
		<attributes/>
	</item>

	<item id="72101" name="Devoted Hero's Doll - Orfen" type="NONE">
	<!-- <Orfen Doll's Sorcery Lv. 3>\nM. Atk. +15%\nM. Skill Critical Damage +10%\nMax MP +15%\n\nBoosts parameters when in inventory. -->
		<restriction stackable="true" tradable="false" dropable="false" sellable="false" private-sellable="false" clan-depositable="false" castle-depositable="false" freightable="false"/>
		<attributes/>
	</item>

	<item id="72102" name="Devoted Hero's Doll - Frintezza" type="NONE">
	<!-- <Frintezza Doll's Sorcery Lv. 3>\nSTR/ INT +2\nDEX/ WIT +2\nCON/ MEN +2\nSkill Power +5%\nAtk. Spd. +100\nCasting Spd. +100\nSpeed +5\n\nBoosts parameters when in inventory. -->
		<restriction stackable="true" tradable="false" dropable="false" sellable="false" private-sellable="false" clan-depositable="false" castle-depositable="false" freightable="false"/>
		<attributes/>
	</item>

	<item id="72111" name="New Year Gift" type="SCROLL">
	<!-- Applies a buff when used.\n\n<Buff effect>\nAtk. Spd./ Casting Spd. +5%\nHP/ MP Recovery Rate +5%\nSpeed +10\n\nDuration: 30 min.\nChanges the armor appearance to that of Santa Outfit. -->
		<restriction tradable="false" dropable="false" sellable="false" private-sellable="false" clan-depositable="false" castle-depositable="false" freightable="false"/>
		<attributes/>
	</item>

	<item id="72114" name="Christmas Kit" type="NONE">
	<!-- Double-click to obtain the following items. -->
		<restriction tradable="false" dropable="false" sellable="false" private-sellable="false" clan-depositable="false" castle-depositable="false" freightable="false"/>
		<attributes/>
	</item>

	<item id="72115" name="Match Girls' Gift" type="NONE">
	<!-- A gift from the Match Girls who are thankful for your help. Double-click to obtain one of the following items. -->
		<restriction tradable="false" dropable="false" sellable="false" private-sellable="false" clan-depositable="false" castle-depositable="false" freightable="false"/>
		<attributes/>
	</item>

	<item id="72179" name="Top-grade Grade A Weapon Pack" type="NONE">
	<!-- Double-click to obtain one of the following items. -->
		<restriction tradable="false" dropable="false" sellable="false" private-sellable="false" clan-depositable="false" castle-depositable="false" freightable="false"/>
		<attributes/>
	</item>

	<item id="72186" name="Special Kit" type="NONE">
	<!-- Double-click to obtain one of the specified items.\n<font color=eeaa22>The right to the priority logging-in is granted until the last day of the month in which the item has been used.</font> -->
		<restriction tradable="false" dropable="false" sellable="false" private-sellable="false" clan-depositable="false" castle-depositable="false" freightable="false"/>
		<attributes/>
	</item>

	<item id="72190" name="Lucky Kit" type="NONE">
	<!-- Double-click to obtain the following items. -->
		<restriction tradable="false" dropable="false" sellable="false" private-sellable="false" clan-depositable="false" castle-depositable="false" freightable="false"/>
		<attributes/>
	</item>

	<item id="72191" name="L-Coins (1000 pcs.)" type="NONE">
	<!-- Double-click to obtain the following items. -->
		<restriction tradable="false" dropable="false" sellable="false" private-sellable="false" clan-depositable="false" castle-depositable="false" freightable="false"/>
		<attributes/>
	</item>

	<item id="72192" name="L-Coins (8000 pcs.)" type="NONE">
	<!-- Double-click to obtain the following items. -->
		<restriction tradable="false" dropable="false" sellable="false" private-sellable="false" clan-depositable="false" castle-depositable="false" freightable="false"/>
		<attributes/>
	</item>

</list>