<?xml version="1.0" encoding="UTF-8"?>
<list xmlns:xsi="http://www.w3.org/2001/XMLSchema-instance" xmlns="http://l2j.org" xsi:schemaLocation="http://l2j.org items.xsd">
	<armor id="26326" name="Baseball Uniform" type="HEAVY" body-part="ALL_DRESS">
	<!-- Lineage II baseball uniform. When equipped, armor is removed and cannot be used. Hair accessories, weapons, and magic armor are not removed. -->
		<restriction sellable="false"/>
		<attributes weight="1000" />
		<crystal />
	</armor>

	<armor id="26327" name="Baseball Cap" type="NONE" body-part="GLOVES">
	<!-- Lineage 2 baseball cap.\n\n<font color=eeaa22>Occupies the left hair accessory slot.</font> -->
		<restriction sellable="false"/>
		<attributes weight="10" />
		<crystal />
	</armor>

	<item id="26354" name="Jewel - Not Available" type="NONE">
	<!-- The item is not available. Used for purchase in Game Store. -->
		<restriction tradable="false" dropable="false" sellable="false" private-sellable="false" clan-depositable="false" castle-depositable="false" freightable="false"/>
		<attributes/>
	</item>

	<armor id="26356" name="Pirate Outfit" type="HEAVY" body-part="ALL_DRESS">
	<!-- Pirate outfit. -->
		<restriction sellable="false"/>
		<attributes />
		<crystal />
	</armor>

</list>