<?xml version="1.0" encoding="UTF-8"?>
<list xmlns:xsi="http://www.w3.org/2001/XMLSchema-instance" xmlns="http://l2j.org" xsi:schemaLocation="http://l2j.org items.xsd">
	<item id="5000" name="Recipe: Damascus Sword (60%)" type="NONE">
	<!-- For Dwarves only. A recipe for Damascus Sword. Requires Create Item Lv. 7. The success rate is 60%. -->
		<restriction/>
		<attributes weight="30" price="1965000" commission-type="RECIPE" immediate-effect="true" action="RECIPE"/>
		<random_craft exp="98250" commission="1965"/>
		<action handler="Recipes"/>
	</item>

	<item id="5001" name="Recipe: Lance (60%)" type="NONE">
	<!-- For Dwarves only. A recipe for Lance. Requires Create Item Lv. 7. The success rate is 60%. -->
		<restriction/>
		<attributes weight="30" price="1965000" commission-type="RECIPE" immediate-effect="true" action="RECIPE"/>
		<random_craft exp="98250" commission="1965"/>
		<action handler="Recipes"/>
	</item>

	<item id="5002" name="Recipe: Deadman's Glory (60%)" type="NONE">
	<!-- For Dwarves only. A recipe for Deadman's Glory. Requires Create Item Lv. 7. The success rate is 60%. -->
		<restriction/>
		<attributes weight="30" price="1965000" commission-type="RECIPE" immediate-effect="true" action="RECIPE"/>
		<random_craft exp="98250" commission="1965"/>
		<action handler="Recipes"/>
	</item>

	<item id="5003" name="Recipe: Art of Battle Axe (60%)" type="NONE">
	<!-- For Dwarves only. A recipe for Art of Battle Axe. Requires Create Item Lv. 7. The success rate is 60%. -->
		<restriction/>
		<attributes weight="30" price="1965000" commission-type="RECIPE" immediate-effect="true" action="RECIPE"/>
		<random_craft exp="98250" commission="1965"/>
		<action handler="Recipes"/>
	</item>

	<item id="5004" name="Recipe: Staff of Evil Spirits (60%)" type="NONE">
	<!-- For Dwarves only. A recipe for Staff of Evil Spirits. Requires Create Item Lv. 7. The success rate is 60%. -->
		<restriction/>
		<attributes weight="30" price="1965000" commission-type="RECIPE" immediate-effect="true" action="RECIPE"/>
		<random_craft exp="98250" commission="1965"/>
		<action handler="Recipes"/>
	</item>

	<item id="5005" name="Recipe: Demon's Dagger (60%)" type="NONE">
	<!-- For Dwarves only. A recipe for Demon's Dagger. Requires Create Item Lv. 7. The success rate is 60%. -->
		<restriction/>
		<attributes weight="30" price="1965000" commission-type="RECIPE" immediate-effect="true" action="RECIPE"/>
		<random_craft exp="98250" commission="1965"/>
		<action handler="Recipes"/>
	</item>

	<item id="5006" name="Recipe: Bellion Cestus (60%)" type="NONE">
	<!-- For Dwarves only. A recipe for Bellion Cestus. Requires Create Item Lv. 7. The success rate is 60%. -->
		<restriction/>
		<attributes weight="30" price="1965000" commission-type="RECIPE" immediate-effect="true" action="RECIPE"/>
		<random_craft exp="98250" commission="1965"/>
		<action handler="Recipes"/>
	</item>

	<item id="5007" name="Recipe: Bow of Peril (60%)" type="NONE">
	<!-- For Dwarves only. A recipe for Bow of Peril. Requires Create Item Lv. 7. The success rate is 60%. -->
		<restriction/>
		<attributes weight="30" price="1965000" commission-type="RECIPE" immediate-effect="true" action="RECIPE"/>
		<random_craft exp="98250" commission="1965"/>
		<action handler="Recipes"/>
	</item>

	<item id="5008" name="Recipe: Pata (60%)" type="NONE">
	<!-- For Dwarves only. A recipe for Pata. Requires Create Item Lv. 6. The success rate is 60%. -->
		<restriction/>
		<attributes weight="30" price="1174500" commission-type="RECIPE" immediate-effect="true" action="RECIPE"/>
		<random_craft exp="58725" commission="1175"/>
		<action handler="Recipes"/>
	</item>

	<item id="5009" name="Trophy of Alliance" type="NONE">
	<!-- Required for Clan Hall wars. -->
		<restriction stackable="true" tradable="false" dropable="false" sellable="false" private-sellable="false" depositable="false" clan-depositable="false" castle-depositable="false" freightable="false"/>
		<attributes price="50" immediate-effect="true" quest-item="true"/>
	</item>

	<item id="5010" name="Echo Crystal - Theme of Victory" type="NONE">
	<!-- Echo crystal that plays the theme music of victory. Will work once and then disappear. -->
		<restriction/>
		<attributes weight="10" price="100" reuse-delay="3000" immediate-effect="true" action="SKILL_REDUCE"/>
		<skill-reducer type="ItemSkills">
			<skill id="2066" value="-1"/>  <!-- Item - Theme Sound Crystal -->
		</skill-reducer>
	</item>

	<item id="5011" name="Star of Destiny" type="NONE">
	<!-- Accessory that Maestro Reorin created after receiving a request from a woman of unknown identity. -->
		<restriction destroyable="false" tradable="false" dropable="false" sellable="false" private-sellable="false" depositable="false" clan-depositable="false" castle-depositable="false" freightable="false"/>
		<attributes immediate-effect="true" quest-item="true"/>
	</item>

	<item id="5012" name="Leikan's Note" type="NONE">
	<!-- Letter received from Guard Leikan. Take it to Piotur at the farm east of the Orc Barracks. -->
		<restriction/>
		<attributes immediate-effect="true" quest-item="true"/>
	</item>

	<item id="5013" name="Spellbook: Elemental Assault - Not Available" type="NONE">
	<!-- The item is not available. A spellbook for learning the Elemental Assault skill. Used by Sorcerers and Spellsingers.\nRequired level: 72. -->
		<restriction/>
		<attributes price="7200" commission-type="SPELLBOOK" immediate-effect="true"/>
		<random_craft exp="3600" commission="72"/>
	</item>

	<item id="5014" name="Spellbook: Elemental Symphony - Not Available" type="NONE">
	<!-- The item is not available. A spellbook for learning the Elemental Symphony skill. Used by Spellsingers.\nRequired level: 72. -->
		<restriction/>
		<attributes price="7200" commission-type="SPELLBOOK" immediate-effect="true"/>
		<random_craft exp="3600" commission="72"/>
	</item>

	<item id="5015" name="Spellbook: Elemental Storm - Not Available" type="NONE">
	<!-- The item is not available. A spellbook for learning the Elemental Storm skill. Used by Spellhowlers.\nRequired level: 72. -->
		<restriction/>
		<attributes price="7200" commission-type="SPELLBOOK" immediate-effect="true"/>
		<random_craft exp="3600" commission="72"/>
	</item>

</list>