<?xml version="1.0" encoding="UTF-8"?>
<list xmlns:xsi="http://www.w3.org/2001/XMLSchema-instance" xmlns="http://l2j.org" xsi:schemaLocation="http://l2j.org items.xsd">
	<armor id="9589" name="Talisman Bracelet Lv. 1" type="NONE" body-part="LEGS">
	<!-- Unlocks 1 talisman slot. Can be compounded with a Talisman Bracelet of the same level. -->
		<restriction freightable="false" sellable="false"/>
		<attributes weight="150" price="1080000" commission-type="BRACELET" enchant-enabled="false" />
		<crystal />
		<skills>
			<skill id="50192"/>  <!-- Talisman Bracelet -->
		</skills>
	</armor>

	<armor id="9590" name="Talisman Bracelet Lv. 2" type="NONE" body-part="LEGS">
	<!-- Unlocks 2 talisman slots. Can be compounded with a Talisman Bracelet of the same level. -->
		<restriction freightable="false" sellable="false"/>
		<attributes weight="150" price="5400000" commission-type="BRACELET" enchant-enabled="false" />
		<crystal />
		<skills>
			<skill id="50192" level="2"/>  <!-- Talisman Bracelet -->
		</skills>
	</armor>

	<armor id="9591" name="Talisman Bracelet Lv. 3" type="NONE" body-part="LEGS">
	<!-- Unlocks 3 talisman slots. Can be compounded with a Talisman Bracelet of the same level. -->
		<restriction freightable="false" sellable="false"/>
		<attributes weight="150" price="27000000" commission-type="BRACELET" enchant-enabled="false" />
		<crystal />
		<skills>
			<skill id="50192" level="3"/>  <!-- Talisman Bracelet -->
		</skills>
	</armor>

</list>